text,label
ተማሪወች ያለም ትምህርት ቤት እንድሄዱ ድርግ ገለጸ ,0
ስለሚድያ ኮሙኒኬሽን ዘርፍ በደሞክራሲ ስርአት ግንባታ ስትራቴጅ ግልጽ ተቀመጠ ,0
ታሪክ ኰራ ዘመን ነገደ ገራ ሞከረ ፋይዳ ቢስ ,1
ሰው ቤት ቀጠረ ልብ አጠበ ሸሚዝ ተኰሰ ሰራ ትልቅ ቤት ,0
ማንኛውም ደባል ሱስ ዞረ ዞረ ተጠቃ ማህበረሰብ አቀፋዊ ባህርይ ,1
ቀድሞ ጓደኛ ውርእ ደስ ስሜት ሰማ ድርግ ቻለ ,0
አጠቃላይ ሚሊዮን በላይ አደሰ ስራ እድል መስክ ሸፈነ ,1
ቃሉ ከልብ ተቀበለ ጠመቀ ቀን ሶስት ሽህ ገደማ ነፍሳት ጨመረ ,0
ደነገጠ ኪስ ብር ውጥእ ሞት ኖረ ቀረበ ልብ አለመ ,1
ጠነከረ ቀጠለ የሚያደናቅፉ ማና ሃይል ተወገደ እግድ ,0
ፍጥነት አደገ ራስ ኖረ ኢትዮጵያ አደገ እኛ አደገ አመነ ,0
አንዳንድ ክልል ፓኬጆቹን መተግበር አስቻለ ግብአት ኖረ የአፈፃጸም ,1
ተደረገ ውይይት የአሰራር መራ ተዘጋጀ ወሰነ መሰረት ሰነድ ተሰናዳ ,1
ተያያዘ አብዮታዊ ድሞክራሲ ቃኘ ድሞክራሲ ትክክል ,0
ሙስና ምቾት ቅምጥል ኑሮ ተነሳ ስነ ምግባር የድስፕሊን ጉድለት ,1
ተረጐመ ስብስብ ቃል ቱቫሉ እንግሊዝኛ መዝገበ ቃል አተመ ነገደ ጠረገ ,1
ተሻለ ለውጥ ጭላንጭል አመት አመት ደፈነ ግጭት መፍትሄ ቀጠለ ,1
ነነዌ ሰወች አምላክ አመኑ ትልቅ አነሳ ትንሽ ጾም አወጁ ማቅ ለበሰ ,1
መአት ያህዌ ኢየሱስ አምላክ መንግስት ንጉስ ድርግ ሾመ ,0
ወና ተመልካች ወሰነ ተወዳደረ ትእይንት ሃሳበ ሰነዘረ ቻለ ,1
ጥበብ ገባ ይልቅ አየለ አውሮፓ ቁሳቁስ ኖረ ገባ ሩጫ ,0
እርስ እንዳለ ሰፈር እግር ኳስ ተዘወተረ ተጫወተ ስፖርት በለጠ ቀልብ ሳበ መጠጠ ,1
ጥቅም ክብር መምህር ወረዳ አስተዳዳሪ በለጠ ሞገስ ያዘ ቈየ ,0
ጀመረ አለቀ ብየ ተወ የስንብት ቀለመ ሶስተኛ አከለ ,0
እኔ በበኩሌ አመነ ፍቅር ተመነ ልብ ዳነ ስራ ሃሴት ድርግ ,1
ቀፈፈ ቴክኒክ ሙያ ስልጠና ተገኘ ግንኙነት ጥንክር ራደ ,1
በታዳሚወቹ እድሜ ልዩነት ኮንሰርቶች ሰፋ ተቻለ ,1
ባለሙያወችን ፈራ ረገድ ጥራት መዘነ አጽንኦት ሰጠ ፈለገ ,1
ጨመረ መድረክ ታዳሚወች አንዳንድ ምሳሌወችን አነሳ አደመ አመነ ቻለ ,1
ቅርብ አወቀ ሰው በረበረ ወለደ ,1
አገር ወጥ ሱጐ ቻለ ታሽጐ ውጭ ምንዛሪ መጣ ጠበቀ ,0
ኢየሱስ አዝመራ ሰራተኛ ፈለገ ጠቈመ ,0
ንግድ በር ተጠጋ ሰገነት ያለው ሽማግሌ ተቀመጠ ,1
ሳምሶምም ጉዳይ አሳሳቢነትን ረዳ ጥያቄ ቀረበ መልስ ጠበቀ ላላ ,0
ተቻለ አቅም ያለው ፈታ ክፍሉ ሰራተኛ ትርፍ አበል ሰራ ,1
ቸገረ አዘነ ሱሪ ቀልብ ጠፋ ተናገረ ምንአልባት ሰካ ላላ ,1
ደንበል ሞገድ ገድ ዌቭ አባት ነገሮ ዳድ ገለጸ ,1
ቀረ ኢንጅኑን ፈለገ መጠን መጣ ሞተር ሳይክሎችን ገዛ ተገደደ ,0
ህዝብ መሬት ገባ ሰወች ጩኸት ሰማ ምድር እኛ ዋጠ ሸሸ ,1
አዘጋጅ ዘልማዳዊ ግትር መድረክ ቅርጽ ደገመ ፈጠራ ብቃት አጠያያቂ ድርግ ,1
አደሰ አበባ ካቲ ደለል ወርቅ ከበረ ድንጋይ ማእድናት ሁለት ክልል ተገኘ ,1
እሴት ስንቄ ዱቤ ቀዳሚነት ጨረሰ ነፃነት ጉደታ አራት ማይክሮ ሴኮንድ ዘገየ ገባ ,1
ትንሽ ራቀ መሬት ደፋ ተቻለ ሰአት እሱ እንድያልፍ ጸለየ ጀመር ,0
ደንብ ፈጸመ አሽከር ህብረተሰብ ,0
ኢየሱስ ሰይጣን ራቀ ያለው ጴጥሮስ ኋላየ ,0
በጀት አመት ተገኘ የኦድት ግኝት ቋጨ ,0
የየቅልና የየብቻ ህልውና ተሸነፈ አፈረ ጀመረ ,0
ወለደ ልጅ መብት ጠየቀ ቤት አሰረ ቀልቧቸው ያለው ,0
ሮም ድያብሎስ ሞት ዳረገ አቅም እንዳለ ገለጸ ቻለ ,0
አነሰ ሃገር የፌስቡክ ተጠቃሚወች ፍሬንድ ሪኩዌስት አከለ ,0
ደም ሰው ህይወት በላይ እጅግ ውድ ፈሳ ,0
ኤፍሬም ሰወች ሃያል ወጋ ልብ ወይን ጠዳ ጠጣ ሰው ሃሴት ድርግ ,1
እነ ሞንዶ ኢትዮጵያ ትራኮችን አነጠፈ እንድሰሩ በትኩረት ተንቀሳቀሰ ሰካ አቀደ ,0
ጭቅጭቅ ሁለት ወገን ሰነዘረ ተቃራኒ ሃሳብ ሳቢያ ጠብ መራ መልክ ተካረረ ,0
ለእዚህም አካል ሃሳብ መነጨ መተግበር ፋፋ ሚና ወጣ ,0
የመንግስተ ሰማይ ወከለ መልአክ ጉዳይ በቶሎ መፍትሄ ፈለገ ድያብሎስን ድርድር ጋበዘ ,1
ሰወች ሰላም ደፈረሰ ጦርነት ነጋሪት ሊጎስሙ እንቢልታውን ነፋ አስተጋባ ቻለ ,1
ዳዊት ምንዝር ፈጸመ የሴትየዋ በአል ጦርነት ገደለ ሁኔታወችን ምች ናታን አወቀ ,1
ሃገር ዘርፍ ሰራ መሰረት ፈታ ድርድር እንድፈቱ ተደረገ ,1
ያኔ ሃምሳ ሳንቲም ሶስት ተከተለ የክትክት ፊልም ውጥእ ቀን መሸ ,0
ንግግር ተገነዘበ ተቻለ ደነበረ የኒዮ ሊበራል ርእዮተ ተራመደ ,0
ማእከል መረቀ ተማሪወች ስል ጥያቄ አነሳ ,0
ኢሳቅ ጎሳ በዛ ሶማሊያ አርበኛ ታጣቂወች ሃርጌሳ ገባ ሶማሊላንድን ገነጠለ ,0
ማህበር ከዩኒቨርሲቲወች ጋረ የትስስርና የቴክኖሎጅ ሽግግር ፈጠረ ረገድ እንድሁ ሰራ ,1
መስከረም አመመ ፋሽዝምን ውድስ አርበኛ ንቍሽሽ ፃፈ ,0
ከሙርሌ ጎሳ ህፃን ጠለፈ ወሰደ ዜጋ ዋስትና ምንድነው ,0
አነሰ አምስት መቶ የወልቃይት ሃብረተሰብ ጥያቄ ፈረመ ቀረበ አለባቸው ,0
ደርግ ህዝብ ዘንድ ተቀባይነት ዝቅተኛ ለአለም ቀፈፈ ህብረተሰብ ይፋ ውጥእ ,1
አጠቃላይ ተስፋ ጭላንጭል ኖረ ዛር አለባቸው አያል ,1
ሁም ዜጋ ህግ እኩል ተግባር ተረጐመ ህግ በላይነት ሰፈነ ረገጠ ,1
ቤት ጠባብ ሁላችንም በቅርበት ተጠጋግተን ዙሪያ ሰራ ቀረጸ ,0
ሚሊዮን ገደማ አሜሪካዊ አየርላንድ ዝርያ እንዳለ ,0
ውጤታማ መስመር ያዘ መንግስት ክፍተት አለባቸው ስራወች ትኩር ,0
እግዚአብሄር ፈቃድ ሰራ አቀደ ወና ቀጠለ ,0
ግብአት ስፋት አርሶአደር ቀረበ መሬት ፋይናንስ እጥረት ,1
ሩት ነጋ እአአ በአድስ አበባ ከተማ ኢትዮጵያዊ አባት ከአይሪሽ እናት ወለደ ,0
እርግጥ ኮንስትራክሽን ሜጋ ፕሮጀክት መሰለ ተግባር ፋይዳ ኖረ ቻለ ,1
በደል ፍላጎት ተቻለ መጠን ሰወች ቀላል ገባ ቻለ መጽሃፍ ቅዱስ ተዘጋጀ ,0
የኦህደድ ትግል ጉዞ ነፃነት ከፍተኛ ህይወት አካል መስዋእትነት ጠየቀ ,0
ተወዳጀ ነገ አሰበ ወይ ጠየቀ ለነገየ አላህ አወቀ መልስ ,0
ቀላል እጅ ሰጠ ብላተር ቀጠለ እጣ ፈንታ ባልደረባ ዘብጢያ ወይስ ,1
ኢትዮጵያ ደረጀ መልክ ፈረስ ስፖርት ውድድር አፄ ምኒልክ ዘመነ መንግስት ጀመረ ተነገረ ,1
ይሁን አወቀ ድርግ እናንተ ብየ ሏላዊ ጌታ ያህዌ ,1
አብዛኛ ማህበረሰብ ሊከወንና ማህበረሰብ ተቀበለ ቻለ ስነ ልቦናዊ አቋም ,0
ሰነድ ጠቈመ እናት ጤንነት ጠበቀ ህብረተሰብ መብት ክብር ቈጠረ ,1
አዳም ሃጢአት ወረሰ ስህተት መጥፎ ሃጢአት ሰራ ዝንባሌ ,1
ጋምቤላ እንግዳ በሰርከስ ትርኢት ዝግጅት ዘና ጎጆ ጎጆ አፈራ ቀረበ ,0
ንግድ አካል ተከተለ እገሌ ለፕሬዝዳንትነት መረጠ ይፋ ደረገመ ,1
አምላክ ቃል ተገኘ አስደናቂ እውነት በይበልጥ አወቀ ያህዌ ምስክር ገነነ ,1
ዛፍ አደሰ የሚተከ በተነ ለመደ ለመለመ ከተማ ምልክት ግምት ,0
ስልጣን ርክክብ ያቤሎ ከተማ አሬሮ ወረዳ ዝግጅት ተከናወነ ተገኘ ,0
አንኳር ፈታ ስራ ሰራ ,1
ፍች በአል ሚስት ህፃን ቀለብ ተስማማ ፍርድ ቤት ጸደቀ ቻለ ,1
የእእምሮ አወከ እንጀራ አባት በንጽጽር ጥር ትንሽ ጠጠር ዋጠ ,1
መለሰ ጠየቀ ድርግ መጽሃፍ ቅዱስ ጥናት መራ ሰለሰ ጥረት ድርግ ጠየቀ ,0
ጸረ ደሞክራሲያዊነትን ተፋለመ መልካ አስተዳደር ሰፈነ ጣረ ቀላል ,1
ሞት ያለው አፍንጫ ስር ስደት አስቀያሚ አሰቃቂ እውስ ,0
ጣቢያ ብቃት ችሎታ ምንጭ አዘጋጅ አመት የሬድዮና ጥበብ ስራ ቅምር ውጤት ,0
ስራ ጠነከረ ሰራ አምስት አመት ሶስት አመት ለውጥ አመጠ ,0
አፄ ምኒልክ አዋጅ ቃል እግድ ደብዳቤ ሸኘ ድርግ መኮንን አገር ላቀ ,1
ሰራ በጎ ተቀበለ ነገደ መሰለ ,0
ደረሰ ውሃ አለበ ደገመ ደብዛ ጠፋ ሙቀት ደረቀ ,1
ልብ አበለ ነገደ ምርጫ ዋዜማ ከተማ ከፍተኛ ስራ ሃላፊወች መረቀ ,0
ኖራ ስብእናችንም እንደሚያስነገዝበን መፍትሄ ራስ ተቀበለ ,0
ቀጠለ ፍፃሜ ጨዋታ ኮከብ ሊዮኔል ሜሲን ያዘ አርጀንቲና ገነነ ,1
እኔ አብ ትእዛዝ ጠብቄ ፍቅር ኖረ እናንተ ትእዛዝ ጠበቀ ፍቅር ኖረ ,0
ፓርቲ ተቋቋመ ምስረታውን ድርግ ሞከረ ገር አካባቢ ተገኘ ሆቴል ,0
አወቀ አትሌት ኢንቨስትመንት መስክ ገባ ትውልድ ስፍር ለማ ጀመረ ,1
መጽሃፍ ቅዱስ ስነ ምግባር መስፈርት ተኰተኰተ አደጉ ሰወች ምክር እንድለግሱኝ ጠየቀ ,1
አውቶብሱም የላምበት ድልድይ ቈረጠ በቦንብ ፍንዳታ ምክንያት እሳት ይጋያል ,0
ምሳሌ ያህል ቫኔሳ አባት መጠጥ ሱሰኛ ጥቃት ደረሰ ,0
እንድያም ዋጋ ንረት ፈጠረ ቍጥር መንግስት ጥፋት ተላከከ በነጋደወች ,1
ህዝብ ዘለቀ እውነት መሰል ውሸት ገለጠ መጣ ስልት አዋጭነት ከሸፈ ,1
መንግስት መንግስት መዋቅር ስራ ሃላፊነት ሰጠ ሰወች ውሎ አዳር አወቀ አሰበ ,1
ሩት ኦርፋ ይች ደግ አሳቢ ሴት ያህል ወደደ ለም ረዳ ድግት ,0
አምድ ቆመ ቀባ እኔ ስእለት ሳለ ቤቴል እውነተኛ አምላክ እኔ ,1
ተአምር መንግስት ላቦራቶሪወችን ደረጃ አደገ ስልጠና ድጋፍ ድርግ ,0
ድጋፍ ሽእ ክልል ሴት በቃ ሰፋ ርብርብ ድርግ ተገኘ ,0
ጀመረ መሰረታዊ ዝግጅት ስራወች ተግባር ቀየረ ቀጠለ የትኩረት መስክ ,1
ጋዜጠኛ ቀረበ ጥያቄ መለሰ መጣ ሰው ለም ,0
ተቀባ ዳቦ ሲወድቅኮ ተቀባ መሬት ቀባ ላላ ,0
ሰወቹ ተመለከተ አስደናቂ ተአምር ገረመ በላይ ተደሰተ ,0
ከፍተኛ እልቂት ተከተለ ጠኔ እኤአ አገር ሰፈነ ,1
ከፍተኛ ደረጃ ቀረ ረገድ አዋጅ ትግበራ ዘርፈ ፋይዳ ,1
አብዛኛ እኛ ተቋም መጣ ሰወች ፍቅር አጋር እንድያውቁባቸው ፈለገ ,0
ህገ መንግስት ሃሳብ ቀረበ ዳኛ እኮ ይፋ ተባርሯል ,1
እለት እኔ ተነሳ ደስታ ሰማ እኔ ሁልጊዜ ሃሴት ድርግ ,1
ይሁን ኦሊምፒክ በርሊን ማራቶን ጠበቀ አቋም አለም ተደመመ ቻለ ,1
እንደት ሰማ ቀረረ ብየ እኮ ,1
ይሁን ፖለቲካ ዘርፍ መሰለ ኢኮኖሚ እኩል ስኬት መዘገበ ,0
ቀረበ ምክንያት ገንዘብ እጥረት ግብአት ሞላ የመሳሰሉት ጠቀሰ ,1
አደሰ አበባ ልማታዊ ደሞክራሲ አቅጣጫ መራ ፈጣን እድገት ምህዋር ተገኘ ,1
ዳዊት ዜጋ ገባ ጉልተኛ ስርአት ጸረ ደሞክራሲያዊነት ለም ተመኘ ,0
አገር ቀውስ ተነሳ ህይወት ጠፋ ንብረት ወደደ ድርግ ሰራ ,1
ከፈለ መስዋእትነት አላስፈላጊ ባከነ ሰማ ,0
ማእከለኩ መረቀ ስራ ጀመረ ቅርብ አንዳንድ እክል ቀረ ,1
ከተማ አንዳንድ ካፌወች ተሽከረከረ ማቆሚያነት ተዘጋጀ ስፍራ ተከፋ ,0
ዮሃንስ ይሁን ኢየሱስ ደፋር ገለጸ ሰጠ ምክንያት ,0
በአል ሰርግ ሰወችን ሃሴት ሰጠ ክንውን ሙዚቃ ጭፈራ ለመደ ,1
ቍጥር ውል አወቀ ብሄር ውጥእ እጅግ ህዝብ ከአርማጌዶን ተረፈ ,1
ጐዳ ባህል የሰብአዊነትን ስሜት ጠፋ ተወገደ ሰማ ,0
ነፃነት ጸጋ ገፈፈ አንዳንድ ልብ መለሰ ረሳ ገባ ,0
ወጣትነት ፃፈ ስሜት ኖረ ምኞት አለፈ ግብ ደረሰ ዋጠ ወረደ ገጠመ ,0
በኢህአደግ የምትመራዋ አደሰ አበባ መልካ አስተዳደር እጦት ሙስና ቆመ ቻለ ,0
አስቴር ሃማ ሴራ ገለጠ እፎይ ተቀመጠ ቻለ ዳነ ,1
አሳ ስራ ንጹህ ውሃ አሳ የሚበለትበት ቤት ፍሪጅና የመሳሰሉት ፈለገ ,0
ሄኖክ ፍጹም አምላክ ዘር ግሩም እምነት ምሳሌ ወረሰ ,1
ዳበረ ምርት አደገ ግብአት ጠቀመ ቍጥር ያህል ,1
ባህር ጠለል በላይ ሜትር ከፍታ አባይ ወንዝ ገነባ ተገኘ አወቀ ,0
ቀጠለ እስትንፋስ ወንዝ ሰባት ጅረት መታ ሰወችም ከነጫማቸው እንድሻገሩ ድርግ ,1
ደገመ ኢየሱስ እንጨት ቸነከረ ስቃይ ጠጠረ ቈየ ሞተ አባት ሰማ ,1
ድምር ውጤት ኢኮኖሚ መንኮታኮት ፖለቲካ መላ አጣ ማህበራዊ ኑሮ ተመሳቀለ ,1
ህዝብ ሰላማዊ ጥያቄ ጠለፈ ሁከት ብጥብጥ ፈጠረ ቈየ ወገን ውሳኔ መራ ,1
ኖረ ነዳ በአገኘው ገጠመ ደነቀ አየለ ,0
እርግጥ ግጥም እውነት ተሰኘ መፃህፍቱ ድጋሚ አተመ አደባባይ ሳለ ,1
ዛር ድርግ ማንኛውም ሰው ጸጋ ነፈሰ ንቀት ጠላ ,0
ኢትዮጵያ ተኰሰ በግደታ ቆመ ብድር የእርዱታ ገንዘብ ,0
እኤአ ሰኔ ቀን ቃለ መሃላ ፈጸመ መሪነት ተግባር ጀመረ ,0
ቦሪ የሊይዙ ተዘጋጀ ቤት ከተማ ፕላን ቢሮ ፕሮጀክት ፕላን ተቀበለ ,0
ተደሰተ ጣረ ሌላኛውን ከፋ ቀረ ጀመረ ግራ ተጋብቸ ,0
መረረ ጥላቻ ቁጣ ንደት ጩኸት ስድብ ክፋት እናንተ ተወገደ ,0
ሰንደርላንድ ስቴቨን ፍሌቸርን ጨመረ ስምንት ተጫወተ ክለብ ተሰናበተ ,0
አጥንቶቸን አንበሳ ሰበረ ማለዳ አነሳ ምሽት ጨረሰ ,0
መቃብር በላይ ሰፈፈ አለፈ አሰበ ኖረ ስም ,0
ዶር ሰላሜነሽ ጽጌ ህክምና ትምህርት ጀመረ ድግሪ አመመ ታሃሳስ መረቀ ,1
ሰወች አይነት ትልቅ መንግስት ተቋቋመ መጠን ደስተኝነትም የዚያኑ ያህል ሸሸ ,1
ተመለከተ ፍጹም ስፖርታዊ ጨዋነት አጀበ ጥር ተጫወተ ቡድን ዘፈነ ፍልሚያ ደመቀ ,0
እልፍኝ አሽከር ደናግሎች አበባ ተቈጣ ሰጠ ፈጸመ በደናግሎች ,1
አነሰ ትልቅ ዘለፈ እየገሰጹ ትልቅ ሰማ ኖረ ሞከረ እናትየዋ ,0
እኔ ቴድ ቤቴል መንግስት አዳራሽ መጣ እንግዳ ተቀበለ ተደሰተ ,0
አደመ ዘመናዊ ሙዚቃ ዘርፍ ደረጃ ጠበቀ ሙዚቃ ቀረበ ተስፋ ድርግ ,1
ገና ተሳተፈ ድርጅት መዘገበ ፋሲካ ምዝገባ ጎን ጐን እያስኬድነው ,0
ግማሽ ፍፃሜ ደረሰ ወጣት ዋንጫ ምሽት ሁለት ጨዋታወችን አስተናገደ ,0
ባለቅኔ አደይ አበባ ሰቀለ ወፍ መስከረም ጠበቀ መጣ ምስጢር ,1
እርግጥ ህዝብ የእነ መንግስት ገዛ ይሄ ገረመ ,0
ክርክር አለቀ ቀልብ መለሰ አገር ትዝ ,1
ከእዚያን አነሳ ተከተለ አምስት አመት የትኛው አትሌት ዙፋን ወረደ ቻለ ,1
ምክንያት ኢየሱስ እነሆ ቤት እናንተ ተወ ተናገረ ,0
ባለስልጣን ቋጠረ ሸቀጥ ተደራሽነት ትልቅ ስራ ሰራ ጠበቀ ,1
ዜጋ ኑሮ ተሻለ ረገድ ህብረተሰብ ተደሰተ መርሃ ግብር ረገጠ ,1
አልሸባብ ጭፍራ እድል ሰጠ ያለጥርጥር ረብ ኢትዮጵያ ድክም ገደለ ,1
መንግስታዊ መንግስታዊ ድርጅት ረገድ ሚና ጎላ ሰራ ,1
ስም ጠፋ አሉባልታ ተናገረ ግለሰብ ሊገጹና መራ ,1
ጨመረ ባለትዳር ወጣት ወለደ ጠቀመ ትምህርት በድረ ገጽ ወጣ ,0
ተወዳጀ ሰማ ለም አንደኛ ፈረንጅ አገር እድሜ ልክ ደመወዝ ገበረ ,1
ዘመን ረዳ ቅርብ ፈለገ ግንኙነት በራ መተየብ ,1
ትልቅ ሰው ታግሸ ጥያቄ መለሰ አለፈ ድርግ ቻለ ,0
ቃየን ያህዌ ራቀ ኤደን በስተ ምስራቅ ተገኘ ግዞት ምድር ኖረ ጀመረ ,1
ለእነርሱ ስእል ሃዘን ጭንቀት ረሳ አጽናና ረጋ ነፈሰ አደሰ ,0
ግብጽ ጀመረ ላከ ወታደር የመን ገባ አለፈ ማክሰኞ ,0
ቄስ ህዝብ ሰይጣን ቤት ሰይጣን አየለ አወገዘ ሲኒማ ቤት ከሰረ ,1
ሃብት ብክነት ሙስና ባባ አበረ መጣ እጥፋት አጀብ ,1
ምንአልባት ፈጸመ ተቻለ ክፉ ግምት ተናገረ ,0
እንቅፋት አባል ግጥም ደምብ ተከተለ ብርር እርምጃ ወሰደ ,1
በላይ ጨዋታ ጨዋታወችን ተጫወተ ክለብ ለቀቀ ,0
ቀጠሮ መሰረት ቀደመ ደረሰ ከጎብኝወች ናደ ሰው ሰአት ተገኘ ,0
አምላክ አገልጋይ ጽኑ እምነት የሚያንጸባርቁ አንዳንድ መግለጫወች ተመለከተ ,0
ወንበደወች በየሃገራት ወደብ ህገወጥ ንግድ ልውውጥ ጠቀመ ይስተዋላል ,1
ናደ ደንበኛ ግቢ ተመካ ያዘ ገባ ቆመ ውጭ ደረገመ ,0
ገመተ ፈለግ አለፈ ሶስት አመት ሰው ቸገረ ሸቀጥ የትኛው ,1
ዘለቀ መፍትሄ ግጭት ሊያስነሱ ቻለ ጉዳይ ጥንእ ተወገደ ,0
የዚያኔ ባእድ አምልኮ ተከተለ አረብ ካእባ ጣኦት ሰገደ ,0
አክሊል ጥንቅቅ ውል ቋጠረ ታንጉት ፈታ መልስ ጠፋ ዝም ,1
ምቀኛ ጠላት አሉባልታ ተሰቃየ ወጣ ብየ አጀብ ቶርታየን አቀፈ ቤት ገባ ,1
ጀግና ዘገንኩና አፈር ብየ ተወ እድሜ ገፋ ጎበዝ አገር እናት ,0
አንዳንድ ህልውና ማክተሙ ቀረ ታሪክ ቀደመ መሰለ ,0
ንግግር ተዘጋጀ ዋነኛ ትኩረትህ ነጥብ ቃል ሰካ ,0
መንግስት ተሻሻለ ዶላር አስር ብር ሂሳብ ሻ ብር ሰጠ ,0
ላከ ካዛንችስ ተገኘ ፈነደቀ ባህል ምሽት ቤት አመት አደመ ሽልማት ሰራ ,1
ህብረተሰብ ዘንድ ተስፋ ሃገር ጠቀሰ ሃገር ቀጠለ ,0
ምክር ቤት አባል ጐደለ ጠቅላላ ጉባኤ ጠራ አባል ገባ መብት ,0
ጎሳ ወይንም ባህል መሪወች ወይንም አወቀ ማግ ደጅ አድባር ስር ቻለ ,0
ምሳሌ ስልጣን ዘመን ፈጸመ ባለስልጣን ሰቀለ መራ ,1
ቍጥር አንደኛ ደረጃ ትምህርት ቤት ደረሰ ,0
ወኪል በሰርጎ ገብነት አሰማርተው ኢኮኖሚ ፖለቲካ ደባ ፈጸመ ተንቀሳቀሰ ,1
መካር ንጉስ አመት አይነግስ አበው ላላ ,0
ሏንዶውስኪ ክብረወሰን ሰበረ እረፍት መልስ ተጫወተ ግብ ቀረ ,0
ቍጥር ቀነሰ ትኩረቱን በአመዛኙ ሶስተኛ ድግሪ ፕሮግራም ድርግ አቀደ ,0
ገመተ ሙሽራ ሚዜወቿ ዳንስ እንደነ ኤልዳ ታዳሚወችን ገረመ ደነበረ እውስ ,1
አመመ ሁለት ወገን እርስ በር ኰነነ ጽንፍ ረገጠ ሰደበ ቀጠለ ,0
ለእዚህም ትልቅ ምስክር ዛር ሰለቸ ተደመጠ ሙዚቃወች ኖረ ,0
ሁለት ስፖርት አሸናፊወች መግለጫወች ሰጠ ኢትዮጵያዊ ባይተዋር ተቻለ ,1
ሙዚቃ አታሞ ተደለቀ ዳንኪራ ረገጠ ወይን በላይ በላይ አናት አናት ይጨለጣል ,1
አተመ ሃትመት ራስ ደንብ ነጋሪት ጋዜጣ አተመ ወጣ ጀመረ የጸና ,1
ማንኛውም አንባቢ ሁለት ክፍል መጽሃፍ ቢያነብ አጠቃላይ ጭብጥ አመለጠ ለም ,1
አፍሪካ ትልቅ የሊስትሮ ኩባንያ ድርጅት መሰረተ እብሪት ጫነ ቅላፄ ,1
ህመም ሆድ አበጠ መነመነ አይን ቢጫ ቀላ ቀየረ ቤት ተኛ ,1
ሃዋርያ ጳውሎስ ክርስቶስ ኢየሱስ አስተሳሰብ እናንተ ዘንድ ኖረ ,0
ረገድ ኮሚሽን እንስሳ አሳ ሃብት ሚኒስቴር በቅርበት ሰራ ,1
ሪፖርተር ኢትዮጵያ ምስል ቀረበ ስራወች ነሳ ትችት አንዱ ጥራት ,1
ኢየሱስ ፍትሃዊ ገዛ ምድር ሰፈነ ስራ ተሳተፈ ,1
ፕሮፌሰር ሽብር ተድላ ቅብብሎሽ ሩጫ ግጥም ታላቅ ምክር ለገሰ ሰማን ,1
በአል ተያያዘ ቦታወች ሰቀለ ሰንደቅ አላማወች ጉዳይ አሰበ መልካ ,1
መሃል መረመረ ፖሊስ ከተፍ ያለው ደጀን ቅርብ ሰወች ውይ ጀመረ ,1
ድርግ ጠንካራ እምነት ኖረ ስር ጥልቀት ሰደደ ዛፍ ,0
ጴጥሮስ ያህዌ አምላክ ክርስቶስ ቤዛዊ መስዋእት ተቀበለ ግልጽ ,0
ከቤተ ጥንቆላ አወቀ አስጠንቋይ ቢጤ ቤት ያዘ መጣ አፈረ ገረመ ,1
ያለእውቀት እብሪት ግትር አስከፊ ጥፋት ዘለለ ,1
ጽሁፍ የትኩረት ነጥብ ጨረሰ ንኡስ ርእስ ,1
አና ካተሪን ብሮሜል ጀርመን ሰካ ሞደል ፒያኖ ተጫዋችነትም አወቀ ,0
አሊያ ፈጠራ ታሪክ ትልቅ ውሸት ደረሰ ,0
ያህዌ ሙሴ አባት ተፋ ሰባት ቀን ተዋረደ ቈየ ,0
ያህዌ ፍትህ እልክ በላይ ጥብቅ መሰለ ምህረት ፍርዱ ለዘበ ,1
የኬንያው ፕሬዚደንት ኡሁሩ ኬንያታ አልሸባብ ሰጠ ገለጸ ፈጸመ ዋጠ ቻለ ,0
ረጅም እቅድ ረጋ ህይወት እንድኖሩ አስቻለ ምግብ ዋስትና ረገጠ ,0
አመለካከት ድርግ ምርጫወችም ውጥእ ግብ ረገድ ሚና ተጫወተ ,1
ሃገር ኢትዮጵያ እግር ኳስ ፍልስፍና ተቀበለ ንግድ ጀመረ ሰንበትበት ,0
ኢንቨስትመንት እንቅስቃሴ ጥር ሰራ ደነበረ መረጃወች ,0
ፖለቲካ ነጋደወች ህዝብ ፈጠረ ከፈለ ገነነ ሃገር ገደል አፋፍ ቆመ ,1
አይን ህክምና ዋለ ቴክኖሎጅ አፈራ መሳ ቀረበ ረገድ ሰፋ ስራ ሰራ ,1
ኢህአደግ ድሃ ታገለ ታገለ ጭቁን ፓርቲ ሰማ ትችት አየለ ,1
አፄ ፋሲለደስ ቤተ መንግስት ካሳነጹ ዙሪያ ሰባት ቤተ ክርስቲያን ሰራ ,1
እኛ ወጣት ተገኘ ገጠመ ሰላም ጸጥታ ሰፈነ የበኩላችንን ሚና ወጣ አለበ ,1
መፍትሄ ተቋም ግድግዳ ሰቀለ ስነ ምግባር መርህ ,1
በአድስ አበባ ከተማ ግንባታ ተገኘ ብሄራዊ ስታድየም አንዱ ,0
አምላክ ደስታ ተገለገለ ፈለገ ደስተኛ ቻለ ለም ሳበ ,0
ዶክተር ሙኸድን አብዶ ማህጸን ጽንስ ሃክምና እስፔሻሊስትና ማህበር ቦርድ አባል ,0
አባይ ትልቅ አፍሪካ አዞወች ነገሰ ፍጡራን ተገኘ ተቋረጠ ፈሳ ,0
መሰረተ ሃሳብ ይልቅ ተከተለ አሰበ አሉታዊ ክስተት በለጠ አሰበ ,0
ቀን የጉዱማሌ ሜዳወች ባህላዊ አደባባይ ማረከ ትእይንት ተከናወነ ,1
አምላክ የለሽነት ቻለ ሰፋ ትምህርት ቤት ዝግመተ ለውጥ ማረ ,0
ሰቀለ ጨዋታ በአል ውጭ ሰቀለ ጨዋታ ተጫወተ ተቻለ ,1
ተገን ድርግ ህዝብ አሰበ ስልጣን ተገኘ ሃብት ከበተ ,0
