text,label
ምሽት ተረኛ ጥበቃ ሰራተኛ ሃላፊነት በአግባቡ ውጥእ ከወድያ ወድህ ተንጐራደደ ,0
ክብረ ሰማይ መሰለ እጣ ውሃ አቀፈ ደሴት አብያተ ክርስቲያናትና ገዳም ይገ ኛሉ ,0
አህጉሪቱ መዘገበ ፈጣን ኢኮኖሚ እድገት ዋነኛ ግብአት አቅም ቀጠለ ,1
ዝርዝር ረዳ ቴክኒካሊ ሞላ ጎደል አጠቃላይ መዋቅር መጣ ,1
ሃገር ቀጠና ተተራመሰ ድርግ እንቅስቃሴ ጦር ሰራ ማእቀብ ጣለ ,1
ወድያውኑም ሏላዊ ጌታ ያህዌ ያህዌ መልአክ ወዮልኝ ,1
ስምንተኛ ደረጃ ተቀመጠ ቀድሞ የኒውካስትል ዩናይትድ ግብ ጠበቀ ሻካ ሂስሎፕ ,0
በዚያን ኢጣልያኖች ብርቱ ምሽግ ሰራ ሰፈረ ከአይላራቅ ተገኘ ተራራ ጥግ ,1
ጽንፈኛ ዳያስፖራ ፖለቲከኛ ዘረኝነት አመጽ ጦረኝነት ባህርይ ዋንኛ ገለጸ ,1
ኢትዮጵያ ሰንደቅ አላማ መንገድ ሰቀለ ድምቀት ሰጠ ተደሰተ ,1
ኢትዮጵያ አወቀ ሰው ጥፋተኛ ማነው ትክክል ተጠና ረዳ ቻለ ,0
ሃዋሳ ኤርፖርት ቦይንግ ግዙፍ አውሮፕላን ንግድ ቻለ ,0
ተግባራዊነት ሃገር እግር ኳስ አህጉራዊ ደረጃ ለተወዳዳሪነት በቃ አለመ ተቻለ ,1
ወለደ ከአድስ አበባ ደቡባዊ ምእራብ ኪሎ ሜትር ርቀት ተገኘ ወሊሶ ከተማ ,0
መቀሌ ቆይታየ ያነገብኩትን ጥያቄ አደሰ አበባ መለሰ ቅርብ ወዳጀ አወጋ ,0
አመለጠ አንድትም ጋት መላወስ ቻለ እግር ውሃ ቆመ ተሽመደመደ ,1
ምክንያት ከተቀጣሪነት ራስ ቀጠረ ተደረገ ሽግግር አደጋ ኖረ ተቻለ ,1
እርግጥ ጥፋት ፈረደ ከተማ ሸሸ ወጣ አምላክ ፍርድ አመለጠ ,1
መሰረት የናይል ወንዝ ጉዳይ ተጠነጠነ ውሃ ድርሻ ዙሪያ ኖረ ገባ ,0
ኢየሱስ ቀለል ድንቅ ፈውስ ተአምር እንድያደርግ አስቻለ ,1
ጥል ክፋት ተጠናወተ እኮ ሁሌ እናት ተሰቃየ ሚኖረው ,1
ይች እናት ምንአልባት እውቅ ሰጠ ልጅ ወረሰ ጥንካሬ ሃብት ,1
ድረ ገጽ ሚድያ ራስ ገና ጠራ ወጣ ማእቀብ መሰለ ,1
ተኰሰ በዛ ተነሳ ምሽግ ጣራ ወረደ አቧራ ሰበሰበ ሰወች አናት ዘነበ ,1
ጠዋት ሰአት ስፍራ ተነሳ አውቶቡስ ተጓዘ ረፈደ ዘገየ ,0
ሁከት ዳመና ደበዘዘ ጎንደር በነዋሪወቿ ትብብር ቀድሞ ድምቀት መለሰ ,1
አሰረ ሰላም አሰረ ጠነከረ ልባዊ ጥረት ድርግ ,0
እብራዊ ይሁን አረፈ ጭራሽ ሰራ ቆመ ,0
የትኛው መስክ እድገት ተበጀ ልማት ተግባር ማረ ሰው ሃይል ፈለገ ግድ ,1
እነሱ ገባ ምድር ወረሰ ቃል አዘዘ ህግ መለሰ ,1
እርስ ግጭት ውግድ ሰላም ሰፈነ አገር በቀል እውቀት ፈለገ ,1
ድብቅ ሰጠ ስጦታ ቁጣ በረደ ስውር ሰጠ ጉቦ ሃይለኛ ቁጣ ከሰሰ ድርግ ,1
ደመራ ለኰሰ ወደቀ ደረሰ ፊሊፒናዊ ቱሪስት ቈጨ ከርሞ መጣ አለመ ,1
መቶ ፐርሰንት ምርጫ ውጤት ኢትዮጵያ ሃሳብ ብዝሃነት አጣ ,0
ገር ሃገር ህዳሴ እውን ድርግ ተደረገ ርብርብ ወሰነ ሚና ኖረ ,1
እሱ ሃበሻ ሃበሻነትን ነገደ ድርግ ጀመረ ቱግ ,0
ምሳሌ የቀይሽብር ሰማእታት አሰበ ሃውልት ሰቀለ ሰንደቅ አላማወች ,1
ኢየሱስ አስተሳሰብ ገባ እስራኤል ታሪክ ፈጸመ አንዳንድ ክንውን ጠቀሰ ,0
ስራ ከፋ ቸነፈር እኛ ወረደ ፈራ ጉዳይ ዝርዝር አባት ተጫወተ ,1
አምላካዊ ባህርይ በማንጸባረቅ ረገድ ምሳሌ ሰወችን ቻለ ,1
ከፍታ ዝቅታ ፍቅር አለፈ ሁለት ልጅ ወልደ አበረ ሰላም ኖረ ,0
ለቅሶኛውን አይን ሳቀ በላይ ግምት ወጣት ጠበቀ እንደዛ ,0
እስር ቤት ቈየ ወሰን ብል ወሰን ,0
ማተኮር ፈለገ ትልቅ ትእዛዝ ሰጠ ኮንስትራክሽን ኩባንያወች ,0
መልአክ ፍትሃዊ ለድያብሎስ ሙቀት ጭንቅሌህን ዘበተ መሰለ ,0
ህመም ቀነሰ መጠጠ ሰው ምንሽሩን ጣለ እርሻ ሰላማዊ አደገ ,0
አካላ ፃፈ ግጥም ጨመረ ዘ ሩውንስ ኦፍ ኢምፓየር ተሰኘ መጽሃፍ አተመ ,1
መድረክ ተጣመረ ፓርቲወች አንዱ ጣት ቀሰረ ደነበረ እውስ ,1
ኢኮኖሚ ጐዳ መልቲ ሞዳል ትራንስፖርት መጣ እቃወች ነካ ,0
ተሸነፈ ተዘጋጀ ,0
ጴጥሮስ ያእቆብ ዮሃንስ እሱ ያዘ እጅግ ተጨነቀ ረበሸ ጀመር ,0
እንግሊዝ ግትር ግትር አይነት ,1
ተዘጋጀ መሬት ጨረታ ወጣ ህብረተሰብ ይፋ ተደረገ ,1
ተከላከለ ሰራዊት ጸጥታ ሃይለ መላ ህዝብ ጸጥታ ደፈረሰ አለባቸው ,1
እርሻ ስራ ጥር ውጤት ጀመረ ትራክተር ገዛ መስኖ ጠቀመ ጀመረ ,0
ቀደም መንግስት ተቋም ስነ ምግባር መኮንኖች መዋቅር ከፈተ ተደረገ ,1
ሰካ ምክንያት ህዝብ ጠቀመ ሰላም ሁከት ረዳ ,1
መንቆራቸው አካል መጠን ተነፃጸረ ትልቅ ቀላ ሮሮ ነፃ ,0
ፈጠራ በለጠ ኩረጃ ተገኘ መሰለ እኛ ጥበበ መጣ ሰነበተ ,0
ሽልማት ተገኘ አርቲስት ልምድ ልውውጥ ስራ እድል ምች አቀደ ,0
ጉርምስና እድሜ ገነነ አሰበ ችሎታ እጅጉ ዳበረ ,1
ሁለት ሃረግ እርስ በር ደገፈ ሁለት ,0
በጀት አመቱ የተስተዋሉ ድክመት ,0
እርግጥ ጥር አመት ኢትዮጵያ ለገሰ እርዳታ ትልቅ ውለታ ,1
ሙሴ ድንክ ምድረ በዳ ተከለ ቅዱስ አደረ ድንክ ስያሜ አጠረ ,1
እናት አገር ልጅ ፈለገ ሰአት ጠራ እንድያደርሱላት ዘወትር ዝግጁ ,0
እቅድ ጊዮርጊስ ክለብ ውጭ ሃገር አሰልጣኝ ቅጥር አመቱ አነጋጋሪ ጉዳይ ,0
ባህር መሰለ ሰማያዊ በረሃ ሃሩር ነጸብራቅ ሃብረ ማለ ሚራዥ አወቀ ,1
ናደ እህት እሷ ወንድሙ ራስ አይደለሽ ,0
እሱ ያመጹት ሶስት አካል እሱ አመለካከት እንድችሉ ገጠመ ሰጠ ,0
እኛ ትምህርት ቤት ጥናት መረመረ ጐደለ ልእ ቁም ,0
ዘመን ተጠናወተ የተረጅነት ነፈሰ ሻረ የይቻላል ነፈሰ ረገጠ ,1
ጆሮ ጠምዝዠ ውጥእ ራስ እኔ ዋጠ ,0
አመመ በተለምዷዊ ሰራ አገር ቤት እስኪ ህፃን ያዘ ፈለገ ብል ዘመድ ,0
ጠቦት አውራ በግ ፍየል ነጋደ አረብ የቄዳር አለቃ ቀጠረ ,0
ዋና ተልእኮ ሰላም ድህንነትን ጠበቀ አባል ንኡስ ተቋም ,1
እብሪት ድርጊት ሰው አወቀ ሰራ ስህተት ቀለል ተደረገ ,1
መምህር ስራ ገበታ ተገኘ ተማሪወች ቤት መለሰ አወቀ ተቻለ ,0
ለካ ፈላ በረከተ ወጣ ትንሽ ቈየ ጭራሽ ቀነሰ ,0
ሃገር ወጣት ስደት ምክንያት መዘዝ ድስኩር ሰማ ትርፍ ይልቅ ጉዳት ባሰ ,1
አመመ ታምሩ እቅድ ጊዮርጊስ ደጋፊወች ረሳ ጨዋታ ንግድ አለፈ ,0
ስራ ያልኮፈሳት መሰለ ጥንቃቄ ካባ እንደደረበች መረጠ መረጠ ,0
ይሄ ጽንሰ ሃሳብ በላይነት አካባቢወችና ክልል አይነት ግጭት ገጠመ ,0
እውነት ተናገረ ትንኮሳ ሃገር ጥላሸት ቀባ ,0
ቅዝቃዜ አለፈ ሰራተኛ በግ ሸለተ ደስታ ,1
ትልቅ ሙያ ያለው ግሽበት ቀነሰ ብሄራዊ ምርት አሳድጐ ስራ አጥነትን ቀነሰ ተቻለ ,1
ያች ወጣ መግቢያየ ተጎልቸ ሸጠ ካሮት አጠረ መልሰው ረጅም ትካዜ ገብ ,1
መኪና ሰው ዱቤ ሰጠ እኛ ገንዘብ ሰው እኛ ሰው ገንዘብ ,1
ይሁን ተናገረ ኢየሩሳሌም ጠፋ ፈጸመ ክንውን ተመለከተ ,0
አለም ኢትዮጵያዊ ጥንት እንቅልፍ ቅዠት ሁከት ጦርነት መለሰ ,1
ዘገበ አዋጅ ባለስልጣን ያለፍርድቤት ትእዛዝ አሰረ ቤት በረበረ አስቻለ ,1
ስያሜ ሰው ባህርይ ሰው በሰወች ዘንድ ሰጠ ተያያዘ ቻለ አመነ ,0
ግብጽ ምድር ውጥእ አሞራዊ ምድር ወረሰ ምድረ በዳ አመት መራ ,1
ጫካ ድሮ ሰላም መሰለ ወድህ ወድያ ጥንቸል ተመሰገነ ,0
ትንሽ ከዚህች ግለ ሳንሱር ወጣ ሰራ ሚድያና ጋዜጠኛ ተገኘ ውርጅብኝ ጣለ ,0
ቲማቲም ቃሪያ ሽንኩርት ድንች የመሳሰሉት አንዳንድ ደነገጠ ጭማሪ ,0
አማራ ትግራይ ደቡብ አጋር ክልል መሰለ ለውጥ ድምጽ ሰማ ጠበቀ ,0
አትራፊ ለኪነ ጥበብ ገንዘብ ለገሰ ተቋም መንግስት ቀረጥ ቀነሰ ጠየቀ ,1
እውነተኛ ክርስቲያን ገለልተኝነት አቋም ያዘ ክርስቶስ አመነ ,0
ሁለተኛ አካባቢወች ጉዳይ እርግጥ አወቀ ለም ,0
ህክምና መስክ ትልቅ እመርታ ታየ ሰው ልጅ በሽታወች አለቀ ,1
የቴክኖሎጅው ጠቀመ ተመለከተ ለአርሶ አደራ ስልጠና ሰጠ ተዘጋጀ ,0
ግብአት ሰጠ የሁላችንም አቅም ፈቀደ ክፍተት እምነት ,1
አመት ልኡል መለሰ ደን ሰማ ድምጽ እንድያስረዳው ,0
ኢህአደግ ደርግ ስርአት ገር ተከተለ ሽግግር መንግስት መሰረተ አመነ ,1
ፍርድ ዳግመኛ ጽድቅ ተንኰባረቀ ልበ ቅን ሰወችም ተከተለ ,0
አፄ ዮሃንስ ደጃች ወሌ እሳቸው ገባ ከጨጨሆ በላይ ያለው አገር ሰጠ እኔ መጣ ,1
ረገድ ኢትዮጵያ ሙያ ካነ ባለሙያወች በድግሪ ደረጃ ሰለጠነ ሁለት በለጠ ,1
ጳውሎስ ድንክ ሰራ ጥር እቃወች አንዳንድ ምናልባትም ጠቀመ ቻለ ,1
ለእዚህም ዝናብ ውርጭ ተቋቋመ በየተሰማሩበት በጎ ፈቃድ ስራ ሲታተሩ ,1
እነሆ ያህዌ እናንተ ተሾመ ካህን አለቃ አማርያህ ,1
ስፖንጅ መጠን ጠጠር ቱቦ ገነነ ፕላስቲክ ጋን ,1
ብስለት ጐደለ ዋለ ራቀ ሰራ ፓርቲ ሊቀመንበር ኢንጅነር ላቀ ጌትነት ,0
አሰረ ነዶ ላላ ወሰነ ዛላወችን መዘዝ ጣለ ቃረመ ከለከለ ,1
ንግድ ይች አጥር ዘልሎ አጥናፍ ናኘ ብእር ነሸጠ ገጽ ገለበጠ ዘመን የሚዘልለው ,1
ሰበረ ወድያ ህላዌ ለም ላከ ወዳጀን አንዱ እስረኛ ግጥም አስታውሸ ,1
ትእግስት ጠበቀ ረገድ ነቢዩ ሚክያስ ተወ ምሳሌ ትምህርት ቻለ ,1
ውጭ ጉዳይ ሚኒስቴር ንኡስ አንቀጽ ሰጠ ማብራሪያ ተከተለ ሰፈረ ,1
ኢየሱስ ጠቀሰ ሁለተኛ ትልቅ ትእዛዝ ባልንጀራ ነፍስ ወደደ ,1
አሰበ ሃዘን ከፈለ ቃል ተናገረ ሊጽናኑ ቻለ ,0
የንጀቷን መላወስ እንኳን ቢራራላት ,1
ይሄኔ ተቃዋሚወች ሳምንት ደቂቃ የቲቪ አየር ሰአት መደበ ቻለ ,0
ኖረ ስርአት ጸረ ደሞክራሲያዊ ውሸት አሻራ ገና ረገፈ አለቀ ,1
ሰወች ወንድ ጾታ ግንኙነት ፈጸመ ሴት ተገኘ ,0
እኛ አምላክ ጸለየ እነሱ ጥቃት ሌት ተቀን ጠበቀ ጠባቂወችም ቆመ ,0
እንኳን ቀረበ ሃሰተኛ ትምህርት ረዳ ጠየቀ ሰነድ ጠቀመ ግለሰብ ,1
ኖረ ቤት ገነባ አሰበ የኪነ ጥበብ ማእከል እውን ,1
ሰብለ ታክሲ ድስኩር ጥልቀት ገባ ጆሮ ዳመጠ ያህል አደለ ,1
ቀላል ምሰሌ ኖረ አካባቢ ኖረ በአል ሚስት ,0
ልቸ ገባ አዳራሽ ተዘጋጀ ዙፋን ተቀመጠ ወጣ ጠመደ መድፍ ተኰሰ ,1
ጎረቤት ጎረቤት ልጅ ገረፈ ቀረ አይን ቀነአ የመገሰጽ መብት ነፈገ ,1
ዘገየ ፍትህ ነፈገ ቈጠረ ፍትህ ስርአት መንግስት ጥያቄ ገባ ,1
ቀረ እግዚአብሄር ተቻለ መለሰ ተወዳጀ ተበጀ መሰለ ሰማ ,0
ተበደረ ገንዘብ ታማኝነት መለሰ ያለው ግንኙነት ጥር ,0
እስቲ በገጸባህርያት ሳለ ሴራ በማተኮር መሳ ደንብ ተመለከተ ሞከረ ,1
ተወ ደጀን ደህና አመት ቀረ ሰለቸ ,1
መንግስት ሰራ ቤት ስራወችን ጐተተ ነዛ አገር አደሰ ,1
ድርድር እውነተኛ ነገደ ተካሄደ ውጤት ያዘ እንድመጣእንፈልጋለን ,1
ግምት ሰጠ ቁሳቁስ ቀረ ዋንጫ ላቀ ዋጋ ውጥእ ይስተዋላል ,0
ስምህንኮ በቀለ በሻህ ሁለት እጅ ሰላምታ ሰጠ ሰነበተ ,0
ሃገር ምርጫ ኮሚሽን ምርጫ ነፃ ፍትሃዊ ደሞክራሲያዊ ,0
መ ከሰተ በግብረስጋ ምክንያት ከሰተ አካላዊ ጠንቅ ተሻለ መሰለ ,1
ዳዊት የአሂሜሌክን ልጅ ካህን አብያታር ኤፉዱን አመጠ ,0
ቤተሰብ ኮሌጅ ገባ የአዋቂወች አዋቂ ወግ ማእረግ በቃ ጠበቀ ፈለገ ,1
ወንድይፍራው ሲሳይ ሰርከስ ጅማ ቀላቀለ አመመ አመት አደገ ሳለ ,1
ያለሸር ለጠፈ ያለሌብነት ቢሮክራሲ ጥልፍልፍ ደግ ጠፋ ,0
ያእቆብ ድያብሎስን ተቃወመ እሱ እናንተ ሸሸ ,1
አመመ ክልል ሽህ ኩንታል ሰሊጥ ደረሰ ሃገር ላከ ,0
አፍሪካ ኖረ ሚሊዮን ከተሜወች ሚሊዮን ጎዳና ጐሰቈለ መንደር ኖረ ,1
ፓርቲ ደከመ ተነሳ ቢሮ ኪራይ ከፈለ ወር ሽህ ብር አጣ ,0
ይሁን ያህዌ ኢየሱስ ለሽህ አመት ምድር ገዛ መንግስት ንጉስ ድርግ ሾመ ,0
ባለሃብት ጅምላ ፈጸመ አነስተኛ ደካማ ፍረጃ ገባ ,0
ያህዌ ልብ በጥፋተኝነት ስሜት ሰበረ ወረደ ሰው መቸም ተነሳ ,0
ህዝብ ልማት ለደሞክራሲና መልካ አስተዳደር ተግባራዊነት ማነሳሳት አንደኛ ,0
ይሁን ገንዘብ ይልቅ ባልደረባ አለፈ መልካ በለጠ ,1
የደሞክራሲያዊ ብሄርተኝነት ጸር ዜጋ ጨፈለቀ ሞከረ ሰካ ሰካ ,0
አገር ተቀመጠ አልያም ወለደ መረቅ ጠጣ ደረቅ እኮ አደለ ,1
ይልቁንም ዋጋው ከበረ እንቁ በላይ ኧረ ናደ ምድር ተስተካከለ ለም ,1
ክርክር አለቀ ጣሊያን ተነሳ ፋብሪካ እቃ ጫነ ኮንቴነሮች ወደብ ደረስ ,1
እውነት ተናገረ ጣጣ ውጥእ ,0
ህግ አስቀመጠ መስፈርት ልእ ህጋዊ እውቅ ሰጠ ፓርቲ ለኢህአደግ እኩል ,0
ሴት ደፈረ ገባ መስክ አሰበ ,1
ናደ ዝም ብየ ጫካ ምናምን ፈጠረ መሰለ ,0
ህብረተሰብ ቆሻሻ ገባ ደፋ አካባቢ ጠረን አወከ አለፈ ገባ ,1
ታየ አደመ ፈረስ ሰቀለ አስር ብር ተቀበለ ፎቶ አንሽው አበበ ብር ኪስ ገባ ,1
ያህዌ ዘላለም አንድነት እንድኖረን ፈለገ ሃብረት እንድኖረን ሰለጠነ ,0
እኮ ቀለለ ድርሻ አስተዋጽኦ ድርግ ወቀሳ ደረደረ ,1
አንዱ ወረዳ ምክር ቤት ወረዳ ምክር ቤት ፍጹም ተገኘ ,0
ምክንያት ውል አትራፊ አገልግሎት ዋለ ,1
ባዝራ ፈረስ ገለበ ለመደ ገና ልጅነት ,1
ዜጋ ዘለቀ ልማት አሰበ ቀረ እለት ጉርስና አመት ልብ ሞላ ተሳነ ኖረ ,0
ትምህርት ገበታ ጀመረ ትምህርት ተጠነቀቀ ተቋም ስራ ቈየ ,0
እኔ አገር አንተ አገር ምድር ቀረጠ ኖረ መጣ ,0
እንደእራሳቸው መፍትሄ አካል ተንቀሳቀሰ ላላ ,0
አወቀ የኢፌደሪ ትምህርት ሚኒስቴር አፍሪካ ሪሰርች ኤዱኬሽን ፈረመ አባል ,0
ተፈጥሮ ጎሃጽዮን ጓሮ ደጀን ደጃፍ ጠለቀ የማሰችው ጭው ገደል አባይ በረሃ ,1
ቀነአ ብየ ሳለ ሳቀ ፈለገ ራስ ገደብ አይነት ስሜት አነበበ ገጽታ ,0
ሁለተኛ ተግባር ሽግግር መሰረት ድርግ ልማት ቀላል ባቡር አገልግሎት ተመለከተ ,1
እአአ አራት አመት ቍጥር መቶ ደረሰ ,0
ንግድ ዳኝነት ከበደ ምርጫ ቈረፈደ ከሳ ነጣ ,1
ፍቅረ ንዋይ ተጠናወተ ሰው ገንዘብ ኖረ ውድ ገዛ ቻለ ,1
አውሮፓ ገራ ቀውስ መታ ፖላንድ እድገት መዘገበ ,1
መንግስት ሃገር ደረሰ ተቀመጠ ህዳሴ ጉዞ ስኬት ትልቅ ግብአት ዘለቀ ,1
ጥር ጥር ሙገሳ በዛ ጉድለት ዝቅ ቻለ ,0
ሞን ዠነራል ገና ኮሎኔል እናት አገር ኰረፈ ሚሊተሪ መጽሃፍ አተመ ,1
ተግባር ስራ ግጥም እንቅስቃሴወች ባለሙያ ሰለጠነ ጠቀሜታ ላቀ ,0
ብድር ውል አራጣ ጠቀሰ እንዳለ ጠየቀ ተናገረ ,1
አሜሪካ ሄጀ ማረ የቅድመ ምረቃ ትምህርት ወሰደ ይሄ ቴአትር ,0
ፈተነ ፈለገ ምስራቅ አፍሪካ ምርጥ አስር ,0
ኢየሱስ አስተማረ ትምህርት ጸሃፊ አስተማረ ትምህርት እንደት ,0
ሃድነት ትክክል ከበደ እኔ ቢስክሌት ትምህርት ቀጠለ ፈለገ ,0
አጭር ቋንቋ በቅሎ ቤት ሰየመ ወታደር ሰላምታ ደፈነ ጦር ትስስር ,1
ስሜት እሱ ገነነ ስር ሰደደ ኤደን ርግዝ አወቀ ,1
ሻእቢያ አመት ጨለማ አሰረ ቈየ ንብረት ወረሰ ኤርትራ ብርር ,1
እርግጥ አህመድ መሰል አገር አለኝታ ተስፋ ወጣት ስደት ቀረ እንደት ተቻለ ,1
ቀረ ያለው ሰው ፓርቲ በአል መዋቅር ፈታ ገባ ምርጫ ቦርድ ግብእ ,1
የመድብለ ፓርቲ ስርአት ኖረ ለደሞክራሲ ስርአት ካስማ ማገር ገነነ ,1
ብዙወች እያዩ ፈንገስን ገጸ ባህርይ አወቀ ጦቢያ ግጥም በጃዝ መርሃ ግብር ,0
ባለስልጣን መራ አጠፈ ገለጸ እግረመንገዱን ተናገረ ትችት በቃ ,1
ያንን ተከተለ ተፈጥሮ ሃብት ለአንደና ጨረሰ ለወጠ ተሰራ ወይ ,0
ብርሃን ጨለማ ለቀቀ በራ እጦት ገለጠ ወገን ቍጥር ትንሽ ,0
ቀድሞ ርእሰ ፋሽስት ደርግ ቁንጮ ጀግና ውድስ ሰወች አይደለምን ,0
ደቡብ አፍሪካዊ ፍላጎት ኢንቨስትመንት መስክ አንደኛ ቆዳ ኢንዱስትሪ ,1
ነፃነት ይልቅ ባርነት መረጠ ሰውነት አሽክላ ኑባሬ አሜኬላ ኬላ ,1
ሞስኮ ተካሄደ ሻምፒዮና ነሃስ ሜዳሊያ መጣ ቻለ ,0
ፈጠረ አለፈ ጠላት ሰጠ እናተማመናለን አሉላ ዘወር ,0
ወር ባልቴትዋቷ መቶ ሃምሳ ብር ሰጠ መሰገ ተቀበለ ጠየቀ ,0
ድርጅት ንቀት ሞላ እርምጃ አወገዘ ድርጊት ሰለባ ቤተሰብ ሃዘን ,1
ስራ ባልደረባ ጣለ እምነት ሃላፊነት ጥንካሬ እንድወጡ ድርግ ,1
ወጣት ዘንድሮ ድጋፍ መጠን ከፍ ረዳ ሰወች ቍጥር ጨመረ ተናገረ ,0
አለቀሰ እኔ ሳቀ አይነት አስተሳሰብ አነሰ ሳድዝም ስቃይ ተደሰተ ,0
መሰረተ ልማት ኢንዱስትሪ ግብርና ማህበራዊ መስክ ጨበጠ ልማት ,1
ትክክለኛ ሃገር ገጽታ ትክክል ገለጸ ቻለ ሰቀለ አደባባይ ,1
ጉባኤ ማግ ጠበቀ ረገድ ምክንያታዊ አለበ ዳነ ,1
አምባገነን ደርግ ከተማ ትርፍ ቤት ወረሰ አነስተኛ ኪራይ ተመን ህዝብ ተከራየ ,1
ሃና ያህዌ ቀረበ ጸሎት እምነት ያህል ጥልቅ ደነበረ እንደት ,1
ኢትዮጵያ ረዳ ደገመ ድርቅ ረሃብ አደጋ ከሰተ ሃገር ተርታ ,0
ፍየል መበለት ማይችሉ ሰው ፈለግ የነበር ,1
አትሌቲክስ ሁለት ጾታ ተደረገ ውድድር ከፈተ እለት ደመቀ አወቀ ,0
​ ንኡሳን ደም ክፍልፋይ የቀዶ ህክምና ሂደት ረዳ ተመለከተ ,0
የክፉወች አይን ደከመ ሸሸ ብቸኛ ተስፋ ሞት ,1
ድያቆን መጣ ቆርበው እንድጋቡ ቀጠሮ የተደገላቸው ሙሽራ ቀረ ,0
ፓርቲወችም ድርድር ገለልተኛ ወገን መራ ፍላጎት እንዳለ ,1
አዳም ሄዋን ያህዌ ቀደመ ተናገረ መሰረት ሞት ህልውና ውጭ ,0
ጨረታ ውጥእ ባለስልጣን ሰራ ቤት ሰፋ ተዋወቀ ስራ ሰራ ሌላኛው ,0
አብዛኛው ስእል ስራወቹ ረዳ ተደመመ ደነቀ ስሜት ቆመ ተመለከተ ውእል ,1
ርጅ ብር አልቀበለም ሳንቲም ብር ፈለገ ንትርክ ፈጠረ የዚያኑ ያህል ,1
በአግሮ ፕሮሰሲንግ ፓርክ በዋናነት ተሳተፈ አገር ባለሃብት ,0
ማረከ ተደመመ መንግስት ኮሙኒኬሽን ጽቤት ወጣ ሃዘን ገለጸ ,1
መፃህፍቱ ፈጠረ ውዥንብር ገታ ቁጥጥር ስርአት ኖረ ገባ አሰበ ፈለገ ,1
ሚክያስ አመነ እስራኤላዊ አሜከላ ከኩርንችት መሰለ ,0
መሬት ለምነት ጨመረ መጣ ምርት ተሻለ ውጤት ጀመረ ,0
ስህተት ድክመት ኖረ ያህዌ ክርስቶስ ቀረ ከልብ አመነ ,0
ኩባንያወቹ ምርት ሽእ ፈቃድ ወሰደ የሃትመት አይነት አተመ ,1
የሜካፕ ግብአት አገር መረተ ውድ ዋጋ መጣ ዋጋ ከፈለ ተገኘ ,1
መስኖ መሬት አስተዳደር ጠቀመ ግንዛቤ ተከለ ,0
ሃገር ተዋወቀ ገጽታ ገነባ ረገድ አትሌቲክስ ከፍተኛ ያዘ አወቀ ,1
ታችኛው ባህር ወለል ወረደ ራስ አይን ቢሰውር እባብ ነደፈ አዘዘ ,1
ቅድም ክፍሉ ናፍቆት ስሜት ፈጠረ እቃወች አሰቃቂ ሞት ቅሪት መሰለ ,0
ጥናት ጭነት መለሰ ትራንስፖርት አገልግሎት ዘርፍ የሚስተዋሉ ተግዳሮት ዘረዘረ ,1
ቴምብር ሰብሳቢወች ታሪካዊ ወቅታዊ ለማንጸባረቅ አተመ ቴምብር ,1
ስኖዋይት ተወራ ብየ መታ ተረት ቅድሙ መለሰ ,0
አካባቢወች ኖረ ዜጋ ኖረ ባህል ስነ ልቦና ትስስር ረዳ አገዘ ,0
ኤርትራ ጉዳይ ሃይል አንበርክኮ ፈታ ተደረገ ጥረት ጨረፍታ ሞከረ ,1
ማታ ኮ ዘረዘረ ማ ስንት ጠየቀ ,0
እንጀራ መጣ ሁለት ፎከረ ሃይማኖት ጎሳ መስመር ከፈለ ትረካወች ,0
ገለልተኝነት ሃይማኖታዊ ፖለቲካ ተወራ መንግስት አስተዳደራዊ አበረ ተነሳ ,0
ፊንጫ ተወሃደ ንግድ ዝንባሌ እውን ቀረበ ተሻገረ ጀመረ ,1
ቴድ አፈረ ፈጠረ ክስተት ተወዳጀ አድናቂወቹን ከፍ ይቅርታ ጠየቀ በፌስቡኩ ,0
አብዛኛወቹ ጤና ተሻለ ግግም ስራ መስክ ተሰማርተዋል ,1
ሁከት መንስኤ የጸረ ሰላም ሃይል ሃላፊነት ወሰደ ገባ እነሱ ,1
ጥበባዊ ስራወችን አደመ እድሉ ሰወችን ጎዳ ትርኢት ደረሰ ተቻለ ,1
ሃገር ፖለቲካ ፓርቲወች ድርድር ይስሙላ መሰለ ቀረበ መታቀብ አለባቸው ,1
ሶማሊያ ጅቡቲ ሶማሌ ቀረ ንግድ ሽግግር ወጭው ከፍተኛ ,1
ልጅቱም በሰወች ለሰወች ድርጅት ከነቤተሰቦችዋ ረዳ ትምህርት ቀጠለ ተደረገ ,0
ኤሌክትሪክ ቈረጠ ምክንያት ስራ ጀመረ ቈየ ባፈው ሳምንት ይፋ ስራ ጀመረ ,1
ያለው ፍቅር ክርስቲያን አበረ ተሰለፈ ጠየቀ ,0
ሰወቹ መጣ ሸዊት ዋልታ ስለነበር ጥር እነሱ ያዘ ,1
ፖለቲካ መንደር ጎራ ምሃዳሩ ተበላሸ ኩርፊያ ከመቸውም በላይ ጨመረ ,1
አድማጭ መራ መሰረት እርምጃ ወሰደ አለባቸው ግልጽ ,0
ሁፍ ታሪክ መነጥር ተመለከተ አለመ ክርክር ተካፈለ ነፈሰ ,1
ኢኮኖሚ ሽግግር ሂደት መረተ ዘርፍ ኖረ አስተዋጽኦ ከፍተኛ ,1
ገጠር ፕሮጀክት ጠፋ የትኩረት አቅጣጫ ከተማ ዞረ ,0
ከለከለ ብሄራዊ ደሃንነት ጉዳይ ኮሚቴ አባል ፓርላማ ድምጽ ተአቅቦ ሰየመ ,1
ዘግየት ላመ ጡረታ ወጥ ባልደረባ ክፍሉ አሸኛኘት ድርግ ደስተኛ ,1
ጸያፍ ተግባር ተገነዘበ ሰንደቅ አላማ ቀጣ ድርጊት መከተ ገባ ,1
